"Jim Cramer blames bears, media for the public's low interest in stocks",05-12-2019, "'There are vast sums of money to be made here, and far too many people are missing out because theyve been frightened away,' the 'Mad Money' host says."
"Everything Jim Cramer said on 'Mad Money,' including market rotation, Robinhood's 10 million users",04-12-2019, "'Mad Moneys' Jim Cramer breaks down how big funds are shuffling their portfolios and where individual investors can pick stock. He sits down with the CEO of Mattel toy company and the co-founders of stock-trading app Robinhood."
"Cramer's lightning round: Jack Dorsey's move to Africa is 'ill-advised'",04-12-2019, "'Mad Money' host Jim Cramer rings the lightning round bell, which means hes giving his answers to callers stock questions at rapid speed."
"Robinhood democratizes stocks for younger generations, co-founder says",04-12-2019, "'People are paying lower prices and thats something thats gone beyond Robinhood and is now available to tens of millions of consumers across the U.S.,' co-CEO Vladimir Tenev says."
"The future of Mattel is about a lot more than making toys, CEO says",04-12-2019, "It includes robust footprints in areas closely related to toys such as movies, television and live events, Mattel CEO Ynon Kreiz says."
"Jim Cramer: Plan to buy these digitization plays 'on the way down'",04-12-2019, "'The companies being thrown away are those that are surfing the biggest secular growth story of our era: the digitization of enterprises,' the 'Mad Money' host says."
"Everything Jim Cramer said on 'Mad Money,' including China trade fears, Salesforce co-CEO",05-12-2019, "CNBCs Jim Cramer says China is a 'much smaller issue than most people seem to realize,' chats with Salesforce co-CEO Keith Block after the cloud companys earnings and offers stock buying advice to callers."
"Cramer's lightning round: Tobacco stocks don't deserve your money",03-12-2019, "'Mad Money' host Jim Cramer rings the lightning round bell, which means hes giving his answers to callers stock questions at rapid speed."
"Salesforce co-CEO Keith Block downplays profit forecastguidance cut: 'Business looks strong'",03-12-2019, "'We had a great quarter. We have a lot of success,' Salesforce co-CEO Keith Block tells Jim Cramer."
"Jim Cramer: China trade is a 'much smaller issue' on the market than most people realize",03-12-2019, "Trade fears 'will eventually create fabulous discounts' in the stock market, but 'were not totally there yet,' the 'Mad Money' host says."
"The US markets are 'ridiculously complacent': Strategist",03-12-2019, "Kathryn Vera of Bulltick Capital Markets says the U.S. markets are complacent about domestic politics, Fed policy and the trade dispute with China, and thats a cause for concern for investors"
"Everything Jim Cramer said on 'Mad Money,' including bearish feels, 'Medicare for All,' S&P forecast",02-12-2019, "'Mad Moneys' Jim Cramer says stocks need to come down more before theyre safe to buy again, breaks down the latest developments in managed-care stocks and explains why Wall Street could be under pressure in coming months."
"Cramer's lightning round: I think you want to sell some Caterpillar",02-12-2019, "'Mad Money' host Jim Cramer gives callers his thoughts on the stocks of Biogen, Amgen, Caterpillar and others in rapid speed."
"Jim Cramer: We need more 'negativity' in the market before you can start buying again",02-12-2019, "'Once people start worrying again, stocks will come down to more reasonable levels and then you can pounce, but were not there yet,' the 'Mad Money' host says."
"Charts show stocks will face pressure through most of Q1 2020, Jim Cramer says",02-12-2019, "Investors are turning from bullish to bearish and Larry Williams suggests investors 'try to sidestep the pain here,' the 'Mad Money' host says."
"Cramer: Warren's backtrack on 'Medicare for All' is a boon for this managed-care stock",02-12-2019, "UnitedHealths stock has 'caught fire' due in part to Sen. Elizabeth Warren appearing to 'back away' from her 'Medicare for All' proposal, according to Jim Cramer."
"Cramer Remix: The biggest mistake investors can make with taxes",27-11-2019, "Jim Cramer reveals his top rule when it comes to taxes and selling stocks."
"Owning too many stocks and not enough cash can set you up for failure: Cramer",27-11-2019, "Jim Cramer breaks down why owning fewer stocks can help make you more money, and why investors shouldnt be ashamed of having cash on hand."
"Cramer: I helped investors through the 2010 flash crash by following one key rule",27-11-2019, "Jim Cramer builds on his 'nobody ever made a dime panicking' mantra by explaining how investors can apply it to their portfolios."
"Never buy a stock all at once — you'll almost definitely get burned, says Jim Cramer",27-11-2019, "Jim Cramer doubles down on his key investing rule of never buying a desired stock all in one go."
"Cramer's top 2 investing rules for bulls, bears and everyone in between",27-11-2019, "Jim Cramer shares the two most important investing rules he has learned after nearly 40 years in the business."
"Agnico Eagle CEO: There won't be a 'substantial' number of new gold mines built",27-11-2019, "'Its a lot tougher now than it was 10 or 15 years ago,' Agnico Eagle Mines Sean Boyd says."
"Everything Jim Cramer said on 'Mad Money,' including market rally, Robinhood impact and Zappos CEO",26-11-2019, "The 'Mad Money' host explains why the stock market has kept rallying despite some concerns. He also discusses Robinhoods impact on investing and talks tariff impact with the CEO of Zappos."
"Lightning Round Contemplate",26-11-2019, "The 'Mad Money' host says FedEx is too cheap right now, and he also recommended taking some shares of Arrowhead Pharmaceuticals off the table."
"Zappos CEO says trade war tariffs haven't impacted pricing yet",26-11-2019, "Even if tariffs end up putting pressure on Zappos, Hsieh said he believes its loyal customers would continue shopping with the company due to its commitment to customer service."
"Cramer: The stock market will continue rallying despite trade war, impeachment and other concerns",26-11-2019, "The 'Mad Money' host explains that the stock market has remained strong because tariffs havent been as impactful as expected, sensible mergers have been announced and employment remains robust."
"How 3D printing company Carbon is trying to shape the future of manufacturing",26-11-2019, "'This has been an area thats been around for 25, 30 years ... Weve cracked the code on how to do 3D printing 100 to 1,000 times faster,' Carbons Joseph DeSimone says."
"Credit Suisse sees almost 10% upside in the S&P 500 in 2020",25-11-2019, "Jonathan Golub of Credit Suisse says the S&P 500 could move up toward 3,425 in 2020 because of a better economic backdrop and improved earnings. He also says hes not expecting a 'wonderful' trade deal to lift markets and his optimism is not trade dependent."
"Everything Jim Cramer said on 'Mad Money,' including mergers, buy Uber, PVH CEO and sell Sonos",25-11-2019, "CNBCs Jim Cramer explains what the recent mergers tell us about the stock market. The 'Mad Money' host also explains why now is the right time to buy shares of Uber."
"Cramer's lightning round: Take profits and sell some shares of Sonos",25-11-2019, "The 'Mad Money' host also recommends buying shares of Costco when its stock pulls back. He also does not recommend Molson Coors Brewing Company."
"CEO of Calvin Klein owner warns China tariffs could soon hit US economy in a meaningful way",25-11-2019, "The uncertainty of the U.S.-China trade war has been the biggest hindrance to business, PVH CEO Emanuel Chirico said."
"Shares of Uber are now worth buying, Jim Cramer says",25-11-2019, "The 'Mad Money' host has been skeptical of Uber, but he believes there is a clear path for its stock to go higher."
"Cramer: Recent mergers show stocks are not as expensive as people think",25-11-2019, "If stocks were actually overpriced, there would not be as much merger and acquisition activity, the 'Mad Money' host says."
"The S&P 500's chart is signaling a near-term pullback, technical analyst warns",25-11-2019, "The last time the S&P 500s chart showed this, stocks pulled back shortly thereafter, says JC OHara, chief market technician at MKM Partners."
"Everything Jim Cramer said on 'Mad Money,' including trade war progress, Clorox and SoFi CEOs",22-11-2019, "CNBCs Jim Cramer takes a look at a shortened week of Wall Street thats full of earnings reports heading into the Thanksgiving holiday. He sits down with the CEOs of Clorox and fintech disruptor SoFi."
"Cramer's lightning round: Let Tesla shares come down more before buying",22-11-2019, "'Mad Money' host Jim Cramer rings the lightning round bell, which means hes giving his answers to callers stock questions at rapid speed."
"SoFi CEO predicts a 'fair amount of consolidation' to come to financial services industry",17-12-2019, "The financial services industry really hasnt had the type of innovation that youve seen in e-commerce as youve seen in online travel,' SoFi CEO Anthony Noto tells CNBC."
"Clorox CEO: What is good for the environment is good for business",22-11-2019, "'We want to reduce the virgin plastic and fiber that we use in our products and packaging by 50% over the next 10 years,' Clorox CEO Benno Dorer says."
"Cramer's week ahead: A short week on Wall Street stuffed with earnings reports",22-11-2019, "'Will the president slaughter a turkey this year, or slaughter the market? I bet he goes for the former,' 'Mad Moneys' Jim Cramer says."
"'We've been in this slow melt higher,' technical analyst says",22-11-2019, "JC OHara, chief market technician at MKM Partners, and Steve Chiavarone, equity strategist, vice president and portfolio manager at Federated, discuss whats ahead for stocks with CNBCs Mike Santoli."
"Everything Jim Cramer said on 'Mad Money,' including Schwab-TD Ameritrade talks, weed stocks",25-11-2019, "CNBCs Jim Cramer explains what triggered Charles Schwab and TD Ameritrade brokerages to discuss a merger, tells investors its time to sell marijuana stocks and sits down with the CEOs of United Airlines and Advanced Micro Devices."
"Cramer's lightning round: Lululemon will be one of the 'retail survivors'",21-11-2019, "'Mad Money' host Jim Cramer rings the lightning round bell, which means hes giving his answers to callers stock questions at rapid speed."
"Jim Cramer: Robinhood pushed Charles Schwab to deal for TD Ameritrade",21-11-2019, "'These companies have to combine to cut tech spending ... ad spending to defend their turf' from app trading, 'Mad Money' host Jim Cramer says."
"Facts show talk of recession is way overblown, United Airlines CEO says",21-11-2019, "'Ive never seen a wider gap between what is being discussed and trying to be pushed and the facts and the figures that we see,' Oscar Munoz says."
"Sell the pot stocks — the market is 'not what it was cracked up to be,' Jim Cramer says",25-11-2019, "'Companies need to close, funding needs to dry up, mergers must occur. Until then, these stocks are now sell-in-the-strength detritus,' the 'Mad Money' host says."
"Everything Jim Cramer said on 'Mad Money,' including retail earnings, Okta and Tableau Software CEOs",20-11-2019, "CNBCs Jim Cramer breaks down the strengths and weakness behind the earnings reports in Home Depot, Lowes, Kohls and Target. The 'Mad Money' host sits down with the CEOs of Okta and Tableau to get insight into the impact of technology on businesses."
"Cramer's lightning round: I do believe that AT&T is a good stock",20-11-2019, "'Mad Money' host Jim Cramer rings the lightning round bell, which means hes giving his answers to callers stock questions at rapid speed."
"Retailers such as Kohl's 'in trouble' without better digital presence or bargains, Cramer says",20-11-2019, "'Wait for the next round of tariff hikes or nasty trade rhetoric ... to knock down the whole group, and then buy the retail winners,' Jim Cramer says."
"Digital was key difference in rivals Home Depot, Lowe's quarterly reports, Jim Cramer says",20-11-2019, "'These days, people expect everything to be frictionless. The moment they hit any kind of problem, any speed bump, they just take their business elsewhere,' the 'Mad Money' host says."
"Everything Jim Cramer said on 'Mad Money,' including trade hits to tech stocks, Salesforce CEO interview",19-11-2019, "CNBCs Jim Cramer advises investors not to give up software-as-a-service plays, despite boiling trade tensions. The 'Mad Money' host sits down for interviews with executives of Salesforce, Square and RH."
"Cramer's lightning round: I say buy American Tower",19-11-2019, "'Mad Money' host Jim Cramer rings the lightning round bell, which means hes giving his answers to callers stock questions at rapid speed."
"Salesforce's Marc Benioff introduces Customer 360 Truth: The 'computer science holy grail'",19-11-2019, "'Now were entering the fourth stage of computing. Its the pursuit of [the stage known as] single source of truth, and weve built that into our platform,' Marc Benioff tells CNBCs Jim Cramer."
"Selling software service stocks on trade worries is a 'big mistake,' Jim Cramer says",19-11-2019, "Software-as-a-service stocks 'tend to come bouncing back with alacrity because these companies are forces of nature,' 'Mad Moneys' Jim Cramer says."
"Cramer's lightning round: Cannabis ETFs have pulled down GW Pharma",18-11-2019, "'Mad Money' host Jim Cramer rings the lightning round bell, which means hes giving his answers to callers stock questions at rapid speed."
"Airbnb could choose direct listing over IPO in 2020 — 'We don't need the money,' CEO says",18-11-2019, "Most companies rushing to public markets 'need the money. We dont need to raise money and so we havent been in a rush,' Airbnb CEO Brian Chesky says."
"Levi's CEO: 'The best innovation happens when you've got constraints'",18-11-2019, "'Completely unconstrained, an innovation organization can just get lost in the weeds,' Chip Bergh says on 'Mad Money.'"
"'When tech stocks go down they're not necessarily out,' Jim Cramer says",18-11-2019, "Jim Cramer says its 'crazy' to sell semiconductor stocks such as AMD and Nvidia 'when they report good quarters with a tiny bit of irrelevant hair on them.'"
"Everything Jim Cramer said on 'Mad Money,' including upcoming earnings and Walmart",18-11-2019, "The 'Mad Money' host offers his early take on next weeks earnings reports, while also learning about how artificial intelligence is changing how customers interact with brands from LivePersons CEO."
"Cramer's lightning round: I'm a buyer of Wells Fargo",15-11-2019, "The 'Mad Money' host also says that he would not recommend buying any pipeline stocks. But if you own a company such as Kinder Morgan, 'you dont have to get rid of it.'"
"Artificial intelligence has become a driving force in everyday life, says LivePerson CEO",15-11-2019, "'Were one of the few companies where its not a piece of the puzzle. Its the entire puzzle,' LivePerson CEO Robert LoCascio says."
"Cramer's week ahead: Home Depot, Target and Macy's earnings — plus US-China trade developments",15-11-2019, "The 'Mad Money' host explains what he will monitor closely next week, including earnings reports from Kohls and Foot Locker. Hes also watching for news in the U.S.-China trade war."
"Everything Jim Cramer said on 'Mad Money,' including Cisco's quarter, Viacom CEO, trade war divides",14-11-2019, "CNBCs Jim Cramer breaks down how Ciscos stock woes reflect other tech stocks, sits down with Viacom CEO Bob Bakish to talk streaming and the merger with CBS, and explains why the U.S.-China trade war could be at risk of dragging for years."
"Cramer: Ideological divides could make the US-China trade war 'go on for years'",14-11-2019, "'If I were the Chinese, I would rather deal with Trump now, than Trump or Warren later,' the 'Mad Money' host says."
"Cramer's lightning round: I want you to buy CVS",14-11-2019, "'Mad Money' host Jim Cramer rings the lightning round bell, which means hes giving his answers to callers stock questions at rapid speed."
"Jim Cramer: Cisco, enterprise tech stocks 'turned into market punching bags'",14-11-2019, "'The market wants nothing to do with tech companies that serve the enterprise, but ... it loves the consumer,' the 'Mad Money' host says."
"Viacom CEO: We will bring a 'different approach' to compete in streaming",14-11-2019, "When Viacom and CBS merge in December, the reunited entity will combine 'free and paid' products to reach 'the widest accessible market,' Bob Bakish tells Jim Cramer."
"Everything Jim Cramer said on 'Mad Money,' including Disney+ stats, buying Peloton, 5G rollout, Dexcom",13-11-2019, "CNBCs Jim Cramer hails Bob Igers leadership at Disney, explains the right time to buy shares of Peloton, sits down for an interview with Dexcom CEO Kevin Sayer and breaks down the 5G rollout."
"Cramer's lightning round: I want you to own Coca-Cola",13-11-2019, "Its that time again! 'Mad Money' host Jim Cramer rings the lightning round bell, which means hes giving his answers to callers stock questions at rapid speed."
"Big Data is the 'next frontier' for medicine, says Dexcom CEO",13-11-2019, "'When you can do things like that, and deliver results like that with a system, youre really solving a very serious problem,' DexCom CEO Kevin Sayer says."
"Investors should wait for Peloton shares to get hit in early 2020 and then 'pounce,' Jim Cramer says",14-11-2019, "Jim Cramer suggests holding off from buying shares of exercise equipment manufacturer Peloton until after its lockup on insider trading expires in March."
"Disney shares have more upside, 'even after today's phenomenal run,' Jim Cramer says",14-11-2019, "'Not long ago, Iger told me were just getting started, and I say its still not too late to join him on his ride of a lifetime,' the 'Mad Money' host says."
"The RealReal CEO says: 'We keep changing' to fend off fakes",13-11-2019, "The RealReal is constantly updating its operations in an effort to prevent and remove counterfeit products from its website, founder and CEO Julie Wainwright told CNBC Tuesday."
"PayPal CFO: Military veterans have leadership, teamwork skills that 'make us a much better company'",12-11-2019, "'When employers look at the qualities that they want in candidates, military veterans have honed some of those skills in their career,' PayPal CFO John Rainey says."
"Everything Jim Cramer said on 'Mad Money,' including Trump tariff threat, PayPal and RealReal execs",13-11-2019, "CNBCs Jim Cramer flags that the stock market would not be able to absorb another tariff increase on Chinese imports. He sits down with RealReal CEO Julie Wainwright to talk about the companys product authentication process and chats with PayPal CFO."
"Cramer's lightning round: I won't rule out this gold company's stock",12-11-2019, "'Mad Money' host Jim Cramer rings the lightning round bell, which means hes giving his answers to callers stock questions at rapid speed."
"I doubt the stock market can absorb much higher tariffs, Jim Cramer says",12-11-2019, "'If the Chinese really are eager to make a deal, well that would give the averages a major boost,' the 'Mad Money' host says."
"Everything Jim Cramer said on 'Mad Money,' including bear woes, CEO pay",11-11-2019, "CNBCs Jim Cramer breaks down what bear investors are getting wrong about the market, sits down with Norwegian Cruise Line CEO Frank Del Rio on its new ship, explains why there could be more room for the market to run and defends CEO pay."
"The problem with income inequality is not CEO pay — it's everybody else's, Jim Cramer says",11-11-2019, "'Income inequality is a real problem in this country … but the problem is not CEO pay. I think it might be everybody elses pay,' the 'Mad Money' host says."
"The bulls are 'running circles around' the bears, Jim Cramer says",11-11-2019, "'This market just keeps surprising us with companies that are doing better than anyone couldve imagined, or at least their stocks were cheaper than we thought,' the 'Mad Money' host says."
"Cramer's lighting round: The fossil fuels sector is in the house of pain",11-11-2019, "'Mad Money' host Jim Cramer rings the lightning round bell, which means hes giving his answers to callers stock questions at rapid speed."
"Norwegian Cruise is taking the environment 'seriously' by eliminating plastic water bottles, CEO says",11-11-2019, "'We ply the oceans waters. We do everything we possibly can ... to prevent any kind of pollution in the water or in the air,' CEO Frank Del Rio tells Jim Cramer."
"$9 billion money manager who called record run sees new highs ahead",10-11-2019, "The S&P 500 could see even more new highs this year, says Avalon Investment & Advisorys investment chief Bill Stone."
"Everything Jim Cramer said on 'Mad Money,' including stocks for kids, Starbucks hiring veterans",08-11-2019, "CNBCs Jim Cramer says Disney and Nvidia are two stocks to put in your kids portfolio. The 'Mad Money' host also hears from Starbucks CEO Kevin Johnson on hiring veterans."
"Cramer's lightning round: Microsoft is on its way to $150",08-11-2019, "Jim Cramer takes stock questions from and gives his thoughts to military members at the U.S. Airforce Academy in Colorado in a special version of the lightning round."
"Two stocks Jim Cramer says you should add to your kid's portfolio",08-11-2019, "The 'Mad Money' host says to start your childs stock portfolio with shares of Disney and Nvidia."
"Starbucks CEO: We plan to hire 5,000 veterans annually",08-11-2019, "'They make us a better company,' Starbucks CEO Kevin Johnson tells Jim Cramer on 'Mad Money.'"
"TJX, Ross, Burlington are beneficiaries of 'roadkill losers in the mall,' Jim Cramer says",08-11-2019, "Shopping center landlords dont have to worry about off-price retailers going under the next time we have a recession, the 'Mad Money' host says."
"This trend 'can help take us to new highs' this year, says investor",08-11-2019, "The S&P 500 could see even more new highs this year, says Avalon Investment & Advisory Chief Investment Officer and Portfolio Manager Bill Stone."
"$9 billion money manager who called record run predicts more new highs for 2019",08-11-2019, "The S&P 500 could see even more new highs this year, says Avalon Investment & Advisory Chief Investment Officer and Portfolio Manager Bill Stone."
"Everything Jim Cramer said on 'Mad Money,' including trim holdings, 5G plays, trade developments",07-11-2019, "CNBCs Jim Cramer says now is the time to take some profits out of the market. The 'Mad Money' host also explains why 5G is back in vogue."
"Brixmor Property Group CEO on leveraging online shopping to boost its open-air malls",07-11-2019, "'We dedicate a few parking spaces, right out in front of the store,' Brixmor Property Groups James Taylor says. 'The retailers who get it ... theyre seeing growth in their sales through it.'"
"Cramer's lightning round: Here's what to do with Virgin Galactic",07-11-2019, "The 'Mad Money' host takes calls from viewers and gives advice on the stocks of Home Depot, Virgin Galactic and Advanced Micro Devices."
"Qorvo's strong quarter 'breathed new life' into chipmakers, 5G plays, Jim Cramer says",07-11-2019, "'After selling off over the summer, these 5G stocks theyre back and theyre better than ever,' Jim Cramer said Thursday on 'Mad Money.'"
"Jim Cramer: Time to do some strategic selling after a big run in the market",07-11-2019, "The 'Mad Money' host says the market rally creates an opportunity to make profits that can be deployed in a pullback later on."
"Everything Jim Cramer said on 'Mad Money,' including HP and Xerox bid, CVS CEO, Uber versus Lyft",06-11-2019, "CNBCs Jim Cramer discusses why Xeroxs bid for HP wont happen, plus why Lyft is a buy but Uber is not. CVSs CEO also sits down for a 'Mad Money' interview."
"Cramer's lightning round: Do not buy Aurora Cannabis just yet",06-11-2019, "The 'Mad Money' host says to continue owning Microsoft, but back out of Kraft Heinz."
"Jim Cramer issues buy call on Lyft, remains 'pessimistic' on Uber",06-11-2019, "Lyft 'managements promise to deliver positive EBITDA by the end of 2021 now sounds credible,' the 'Mad Money' host says."
"CVS CEO worries teen tobacco use is going the 'wrong way' with vaping crisis",06-11-2019, "'Weve got to get our arms around that issue and reverse that trend,' CEO Larry Merlo tells Jim Cramer."
"There is no way Xerox can pull off a deal to buy HP, Jim Cramer says",06-11-2019, "While the 'Mad Money' host says he likes mergers and acquisitions, he warns viewers not to make stock decisions solely on possible deals."
"Everything Jim Cramer said on 'Mad Money,' including growth and value stocks, Twilio CEO, AI trading",05-11-2019, "CNBCs Jim Cramer breaks down Wall Streets sentiment toward high-growth and value stocks, sits down with FireEye CEO Kevin Mandia, gets an explanation from Twilio CEO Jeff Lawson about a forecast error and berates the machine trading of stocks."
"Mea culpa — Twilio CEO assures Jim Cramer 'simple math error' will never happen again",05-11-2019, "'We have instituted additional processes and controls to make sure such an error cannot happen again,' Twilio CEO Jeff Lawson says in a 'Mad Money' interview."
"Jim Cramer rails on machine trading — 'the whole darned thing is a travesty'",05-11-2019, "Automated trading 'destroys what makes the American market so great: deep liquidity that leads to real price discovery,' 'Mad Money' host Jim Cramer says."
"Misinformation — not voting machine hacks — is biggest threat to 2020 election, FireEye CEO says",05-11-2019, "The cybersecurity executive says targeted campaigns to sway voters opinions is what worries him ahead of the 2020 election."
