"Cramer: Post Holdings' portfolio gives stock 'room to run'",16-08-2018, "Jim Cramer says Post Holdings spin-off of its private label division and smart acquisitions have shown that the company knows how to unlock value."
"Sen. Elizabeth Warren: Trade deals help companies, not workers",15-08-2018, "Jim Cramer sits down with Sen. Elizabeth Warren to discuss her new bill, the Accountable Capitalism Act, and also hear her views on U.S. trade policies."
"Cramer: Global sell-off isn't 'as special as it seems'",15-08-2018, "Jim Cramer explains how the global sell-off is related to Turkey, China and Macys and why it isnt as big of a deal as investors might think. "
"Brinks CEO: We’re ‘ready’ for Canadian marijuana legalization",14-08-2018, "Brinks CEO Douglas Pertz says that the cash management company is ready to benefit from legal cannabis in Canada, starting October 17."
"Cramer Remix: Why this stock could be red hot",15-08-2018, "Jim Cramer explains how CVS could crush the competition once the Aetna deal is complete. "
"Cramer: Tesla bears should think twice before shorting the stock",14-08-2018, "Jim Cramer says that even skeptical Tesla investors should stay away from shorting the stock because it never ends well."
"Tapestry CEO: Accessories has seen 'terrific' growth in the last year",15-08-2018, "Tapestry CEO Victor Luis tells Jim Cramer how his company beat top and bottom line expectations for its fourth quarter."
"Cramer's lightning round: Avoid stocks related to housing",14-08-2018, "Jim Cramer shares his take on callers favorite stocks, including why he doesnt 'want anything to do with' housing-related stocks."
"Cramer’s charts suggest it’s still worth investing in bonds",14-08-2018, "Jim Cramer and technician Carley Garner find reasons to believe U.S. Treasury bonds still have some upside."
"Cramer: These companies’ earnings show that millennials are spending money on handbags, not houses",14-08-2018, "Jim Cramer gives his take on shifting consumer spending habits."
"Cramer Remix: Don’t worry about this stock’s post-earnings drop",14-08-2018, "Jim Cramer breaks down why Dropbox’s recent decline is not worth fretting about"
"Cramer's lightning round: Bet on Norwegian Cruise Line, not Carnival",13-08-2018, "Jim Cramer shares his take on callers favorite stocks, including which cruise lines numbers show the best growth."
"Cramer: Booking Holdings needs to decide whether it’s a growth stock or a value stock",14-08-2018, "Jim Cramer reviews Booking Holdings pivot from boosting growth to boosting profits."
"Cramer: ‘Stay away’ from banks, other contaminated stocks to ride out the Turkish crisis",13-08-2018, "Jim Cramer says that the Turkish currency crisis could be a buying opportunity for smart investors, as long as they stay away from banks and other contaminated stocks."
"Cramer's game plan: Take time to study your stocks as earnings season fades",10-08-2018, "Jim Cramer recommends investors use next weeks lack of earnings reports to do their homework and make informed decisions."
"Obscure market statistic could point to record highs for S&P 500 by year-end",23-08-2018, "While the dog days of summer have failed to produce record highs for the S&P 500, one widely followed strategist has a simple message for investors: wait until winter. "
"Cramer Remix: Trade sanctions are hurting hedge funds the most",09-08-2018, "Jim Cramer breaks down why hedge funds are feeling the pain when it comes to tariffs."
"Cramer's lightning round: Coal-05-be in a renaissance, but don't buy the stocks",09-08-2018, "Jim Cramer shares his take on callers favorite stocks at lightning speed, including a coal play that might seem intriguing."
"Cramer praises WWE's growth story, says investors can buy 'a small position' after monster run",09-08-2018, "Jim Cramer tracks professional wrestling broadcaster WWEs growth story and explains why the stock is worth buying on a pullback."
"Top auto supplier Magna takes $60 million hit from tariffs, but CEO still sees 'huge' opportunity",09-08-2018, "Jim Cramer sits down with Magna International CEO Don Walker, who explains the effects of the Trump administrations tariffs on his manufacturing company."
"Cramer: I'd rather own the 'given-up-on' stock of Viacom than CBS",09-08-2018, "Jim Cramer backs Viacoms turnaround and says it has 'much more opportunity for upside' than the beloved CBS."
"Cramer Remix: Even the Death Star can’t wipe out an industry overnight",08-08-2018, "Jim Cramer details how the stocks of CVS and AutoZone escaped from Amazon’s grips. "
"Cramer's 4 reasons for why Tesla's shorts are facing an uphill battle with Elon Musk",08-08-2018, "Jim Cramer explains why Teslas short-sellers might be up against 'the greatest short-buster in modern memory' in Elon Musk."
"Cramer's lightning round: If Zuora's stock dips, buy more",08-08-2018, "Jim Cramer zooms through his take on callers favorite stocks, including a play on the growing subscription economy."
"Cramer says newly public Sonos reminds him of Fitbit: 'I'm not going to make the same mistake twice'",08-08-2018, "Jim Cramer has his doubts about Sonos IPO after being burned by the similarly structured Fitbit."
"Cramer: Disney's Bob Iger deserves the benefit of the doubt after earnings miss",08-08-2018, "Jim Cramer puts faith in Disney CEO Bob Iger after the entertainment giant missed Wall Streets third-quarter earnings expectations."
"Cramer Remix: Tesla news sends bond prices higher",07-08-2018, "Jim Cramer breaks down how Elon Musk’s tweet on taking Tesla private impacted the bond market."
"Cramer's lightning round: 'I don't want to be in any stock' levered to solar",07-08-2018, "Jim Cramer flies through his take on callers favorite stocks, including an entire group of stocks that arent exactly piquing his interest."
"Cramer's charts say Costco and Target are ready for pullbacks, but Walmart's a buy",07-08-2018, "Jim Cramer turns to technicians Tim Collins and Larry Williams for a look at the charts of big-box retailers boosting their e-commerce wares to compete with Amazon."
"It's 'inevitable' that esports will be part of the Olympics, Logitech CEO says",07-08-2018, "Jim Cramer sits down with Logitech International President and CEO Bracken Darrell, who says esports will be in the Olympics and could be the biggest sport in the world."
"Cramer says index fund buying and buybacks are creating a 'stock shortage'",07-08-2018, "Jim Cramer attributes the markets rally to the confluence of two drivers: increased index fund investing and corporate share buybacks."
"Cramer Remix: Why buyers are forgiving Disney ahead of earnings",09-08-2018, "Jim Cramer is explaining why buyers are forgiving and forgetting Disney’s troubles ahead of its third-quarter earnings. "
"Cramer's lightning round: Don't buy US Steel because of slower economy",07-08-2018, "Jim Cramer shoots through his take on callers favorite stocks, including a red-hot advertising technology stock."
"Cramer reviews Expedia's breakout quarter",06-08-2018, "Cramer talks about how Expedia has once again won over the market after its standout second-quarter earnings results."
"Cramer: Outgoing PepsiCo CEO 'saw the future coming' when few did",07-08-2018, "Jim Cramer talks about his personal experience with outgoing PepsiCo CEO Indra Nooyi."
"Cramer: Facebook's reported discussions with banks should give investors pause",06-08-2018, "Jim Cramer makes the case that investors should be slow to forgive and forget Facebooks past missteps after a report that the company is looking to get more banks and financial institutions to use Messenger."
"One of market’s biggest bulls takes a ‘few chips off the table,’ sees impending sell-off",04-08-2018, "Steve Chiavarone predicts stocks will fall 5 to 8 percent before summer ends."
"Cramer's game plan: 'Stick to your knitting' and keep an eye on consumer data, earnings",03-08-2018, "Jim Cramer picks through the earnings confusion in the week ahead and advises investors on how to play the action."
"11 years later: Cramer's 'They know nothing!' rant — Here's the complete transcript",21-09-2019, "Jim Cramer sounded off on the Federal Reserve for not anticipating the coming financial crisis 10 years ago today."
"Cramer Remix: Apple won’t be the only company to hit $1 trillion",02-08-2018, "Jim Cramer explains what makes Apple’s trillion dollar market cap so meaningful."
"Dow Chemical CEO: 'I've never seen the industry more aligned' around tackling plastic waste",02-08-2018, "Jim Cramer sits down with Jim Fitterling, CEO of DowDuPont subsidiary The Dow Chemical Company, to hear about its impending spin-off and the chemical business at large."
"Cramer's lightning round: Things are looking up for Southwest Airlines—buy more",02-08-2018, "Jim Cramer shares his take on callers favorite stocks at lightning speed, including an airline play that could soon fly higher."
"Cramer: Don't own the stocks of companies fending off competition—they can be 'treacherous'",02-08-2018, "Jim Cramer tells investors to steer clear of buying shares in companies like Red Robin Gourmet that are facing fierce industry competition."
"Cramer: 10 reasons why Apple hitting $1 trillion matters for the stock market",02-08-2018, "Jim Cramer breaks down why Apples trillion-dollar breakthrough speaks volumes about the state of the stock market."
"Starbucks CEO confirms Alibaba partnership, plans to expand delivery to 2,000 stores in China",02-08-2018, "Starbucks CEO Kevin Johnson tells CNBC that the coffeemakers just-announced partnership with Alibaba will, without a doubt, 'be an accelerator for our business.'"
"Cramer Remix: Why Amazon’s latest quarter was a thing of beauty",01-08-2018, "Jim Cramer explains why Amazon remains on fire despite other FANG stocks faltering."
"Cramer's lightning round: Buy some Dropbox stock ahead of its earnings report",01-08-2018, "Jim Cramer zooms through his take on callers favorite stocks, including a fresh-faced technology play dipping ahead of earnings."
"Cramer finds new ways to play the 'stay-at-home' economy",01-08-2018, "Jim Cramer takes a new approach to the 'stay-at-home' economy by flagging plays like Conagra Brands, Disney and Spotify."
"Cramer makes the case for valuing Apple's stock like Procter & Gamble's",01-08-2018, "Jim Cramer doubles down on his call for Apples stock to be valued like any other consumer products company."
"Cramer points to the market's 'endless buying opportunities' as stocks slide on trade war worries",01-08-2018, "Jim Cramer says the markets trade-war-related dips create bountiful investment opportunities in the hardest-hit sectors."
"Cramer Remix: Apple is the greatest consumer products story ever",31-07-2018, "Jim Cramer explains why the tech giant could have staying power as a consumer product story."
"Cramer's lightning round: The case for buying the best-of-breed stock of UnitedHealth",31-07-2018, "Jim Cramer flies through his take on callers favorite stocks, including a health care play thats leading its sector."
"Cramer's charts suggest gold could be nearing a bottom",31-07-2018, "Jim Cramer and technician Carley Garner inspect the charts related to gold to see if the precious metal could be ripe for a run."
"Cramer: If you're worried about the economy, just look at the retail stocks",31-07-2018, "Jim Cramer makes the case for embracing the strength of the U.S. economy by tracking the gains in top retail stocks like Walmart."
"Cramer says Apple's stock could have a $300 price target if it were only valued properly",31-07-2018, "Jim Cramer argues that Apple should be seen as a consumer products company rather than a technology player after its third-quarter earnings beat."
"Cramer Remix: Panic could help investors catch a bargain",30-07-2018, "Jim Cramer breaks down how the collateral damage of Monday’s panic could create a prime buying opportunity."
"Cramer's lightning round: Buy into Allergan's roaring stock below $180",30-07-2018, "Jim Cramer rattles off his take on callers favorite stocks, including a pharmaceutical play on a tear."
"Cramer says NXP Semiconductors is a buy despite failed Qualcomm deal",30-07-2018, "Jim Cramer argues that NXP Semiconductors prospects are still intact after Qualcomm dropped its bid for the chipmaker."
"Cramer flags the 'clear winners' of earnings season: AMD, Microsoft, Amazon and Alphabet",30-07-2018, "Jim Cramer highlights the companies that wowed analysts and investors with their mid-2018 earnings results."
"Cramer: Facebook's 'collateral damage' could be a buying opportunity",30-07-2018, "Jim Cramer recommends picking through the stocks damaged by investors panic around Facebook earnings for hidden potential."
"Kanye West beat the market by more than 40 percent",28-07-2018, "According to CNBCs analysis, the portfolio rapper Kanye West chose for wife Kim Kardashian has outperformed the S&P 500 Index by more than 40 percent."
"Rising rates likely to shake stocks to core, veteran investor Peter Boockvar warns",25-07-2018, "The Bleakley Advisory Groups Peter Boockvar sees 'early tremors' in the global bond market."
"Wall Street bull says a near-term pullback is coming",24-07-2018, "Despite the booming economy, market strategist and Wall Street bull Tony Dwyer predicts a near-term pullback of 5 to 10 percent."
"PepsiCo taking century-old MSG contract from Coca-Cola more a symbolic than economic win: Investor",24-07-2018, "PepsiCo taking a century-old Madison Square Garden contract from Coca-Cola is more a symbolic than economic win, says investor."
"Cramer Remix: This former market darling has an equation for gains",24-07-2018, "Jim Cramer calculates how health-focused conglomerate Danaher could still get its groove back."
"Cramer's lightning round: You haven't missed your chance to buy shares of WWE",24-07-2018, "Jim Cramer zips through his take on callers favorite stocks, including a subscription-based entertainment play that could still be packing a punch."
"Cramer says FANG stocks could still have room to run after Alphabet's quarter",24-07-2018, "Jim Cramer says Alphabets latest quarter proved that shares of the Google parent and other tech titans could still have room to run."
"Cramer: Charts suggest S&P 500 could make new all-time highs by the end of earnings season",24-07-2018, "Jim Cramer enlists technician Mark Sebastian to vet the action in the VIX and ensure that another major sell-off isnt in the works."
"Cramer: 'If I had to sum up this market in a word, I’d call it extremist'",24-07-2018, "Jim Cramer cautions against investing in extreme moves in the market before knowing whats really going on."
"David Rosenberg issues bubble warning in credit market: It will tear into stocks",24-07-2018, "Gluskin Sheff’s David Rosenberg predicts the widening credit spreads will take down stocks.  "
"Cramer Remix: Alphabet has broken this troubling trend after reporting earnings",23-07-2018, "Jim Cramer explains how Alphabet has debunked the stock’s trend in sliding post-earnings."
"Cramer's lightning round: Sell half of your position in beer stocks on concerning industry trends",23-07-2018, "Jim Cramer flies through his take on callers favorite stocks, including the beer space and why he thinks its risky."
"No longer 'trapped at a non-food company,' Frank's RedHot drives growth for McCormick, CEO says",23-07-2018, "Jim Cramer sits down with McCormick Chairman, President and CEO to get the latest on the spice makers growth-driven business."
"Dungeons & Dragons is having its best year ever, Hasbro CEO says",28-02-2019, "Jim Cramer speaks to Hasbro Chairman and CEO Brian Goldner, who touts his toymakers legacy games and budding esports properties."
"Cramer: Stocks could 'go much higher' if the EU caves on tariffs",23-07-2018, "Jim Cramer says that a deal between the European Union and the United States on tariffs could spark a stock market rally."
"Markets ready to hit new highs?",24-07-2018, "Thursday will mark the 6-month mark since the last S&P 500 market high. CNBCs Mike Santoli joins the Fast Money Halftime Report to discuss if there are enough factors at play to take the market to a new recovery period. "
"Cramer Remix: The most worshiped group in this market",19-07-2018, "Jim Cramer explains why analysts can’t resist the digital payment space. "
"Cramer's lightning round: Take advantage of BlackRock's rare stock dip",19-07-2018, "Jim Cramer shares his take on callers favorite stocks, including an investment management play thats on an unusual downtrend."
"Nucor CEO touts second-best quarter in steelmaker's history, nods to tariffs",19-07-2018, "Jim Cramer hears from Nucor Chairman, President and CEO John Ferriola, who touts the effects of President Donald Trumps steel and aluminum tariffs."
"New Domino's Pizza CEO describes 'fortressing process' with hotspot initiative",19-07-2018, "Jim Cramer gets the latest on pizza trends with Dominos Pizzas new President and CEO Richard Allison."
"Cramer expects 'total revaluation' of Comcast and Disney as bidding war for Fox winds down",19-07-2018, "Jim Cramer anticipates more gains for shares of Disney and Comcast as the companies battle over Twenty-First Century Foxs assets comes to a close."
"Microsoft's 17 percent revenue growth is not sustainable, says CFRA Research's Kessler",19-07-2018, "Kevin Landis of Firsthand Capital Management and Scott Kessler of CFRA research join the Closing Bell crew to discuss Microsofts Q2 earnings announcement and its Github acquisition. "
"UBS's Erin Browne: S&P 500 is going to end higher by end of year",19-07-2018, "Erin Browne, UBS Asset management asset allocation head, joins Joe Terranova of Virtus Investment Partners; Steve Weiss of Short Hill Capital Partners; Jon Najarian of Investitute.com; Pete Najarian of Najarian Family Office; and CNBCs Scott Wapner to discuss the market future and how the markets run has been. "
"Cramer Remix: Don’t despair about the transports’ weakness",18-07-2018, "Jim Cramer explains why investors shouldn’t worry about the slumping transportation stocks after United Continental’s quarter."
"Cramer's lightning round: The turn in Advanced Micro Devices' stock is real",18-07-2018, "Jim Cramer zooms through his take on callers favorite stocks, including a chipmaker thats making a comeback."
"Cramer's take on retail REIT stocks: Their 'remarkable comeback' might not be worth your cash",18-07-2018, "Jim Cramer says the retail resurgence is boosting business at affiliated real estate investment trusts, but says hes not enthusiastic about REIT stocks just yet."
"Big banks like Deutsche choose IBM to run their blockchain for 3 reasons, IBM executive says",18-07-2018, "Jim Cramer sits down with Martin Schroeter, senior vice president of IBM global markets, who says IBM is a leading choice for blockchain implementation among international companies."
"Cramer: If you own shares in companies with business in China, you should be worried",19-07-2018, "Jim Cramer warns investors of Boeing, Caterpillar and other China-reliant stocks that the trade war could still get worse."
"Cramer Remix: Make yourself at home in this stock",17-07-2018, "Jim Cramer reveals why Williams-Sonoma is in a sweet spot in the home goods space."
"Cramer's lightning round: Business at Illinois Tool Works isn't as bad as the stock suggests",17-07-2018, "Jim Cramer flies through his take on callers favorite stocks, including a toolmaker thats out of step with its shares."
"Cramer's charts suggest big-name biotech stocks Gilead and Celgene have more room to run",17-07-2018, "Jim Cramer and technician Bob Lang inspect the charts to see if big-cap biotechnology stocks like Gilead and Celgene could have more room to run."
"Cramer: Top retail plays Canada Goose, Lululemon and Urban Outfitters are winning with 2 key drivers",17-07-2018, "Jim Cramer says a 'keen grasp of fashion' and strong execution have made the stocks of Canada Goose, Lululemon and Urban Outfitters stellar investments."
"Cramer explains how Netflix's stock managed to taper its drop after disappointing on earnings",17-07-2018, "Jim Cramer breaks down his theories on why shares of Netflix were able to pare their losses after the companys second-quarter earnings report failed to appease investors."
"GDP could rise to 4 percent in Q2 thanks to business-friendly policies, Bank of America CEO says",17-07-2018, "Jim Cramer sits down with Bank of America Chairman and CEO Brian Moynihan, who outlines the U.S. economys growth drivers."
"Cramer Remix: You should be buying the oil stocks here",16-07-2018, "Jim Cramer explains that even though the price of oil is dropping, now could be the time to buy shares of oil companies."
"Cramer's lightning round: The best way to add gold to your portfolio",16-07-2018, "Jim Cramer rattles off his take on callers favorite stocks, including his take on how investors should approach the gold market."
"Bank of America CEO: Our mobile banking strength 'goes far beyond the millennials'",16-07-2018, "Jim Cramer sits down with Bank of America Chairman and CEO Brian Moynihan after earnings to crunch the numbers and hear what’s next for the financial giant."
"Cramer: One analyst report caused spice maker McCormick's stock to languish for months—until now",16-07-2018, "Jim Cramer says spice maker McCormicks stock is finally escaping the pain brought about by a January analyst report from Deutsche Bank."
"Cramer flags opportunity in FANG after Netflix's 'less-than-stellar' quarter",16-07-2018, "Jim Cramer spots a chance to invest in the FANG and subscription-service stocks after what he calls a 'disappointing' quarter from Netflix."
"People are 'numb' to Trump's behavior, says Wall Street veteran",13-07-2018, "President Trump continues his unorthodox approach to the presidency, upsetting some people, while others are left 'numb' to his behavior, says Wall Street investor. "
"This CEO is watching out for the 2,800 level of the S&P 500",13-07-2018, "Michael Jones of RiverFront Investment Group says he is 'skeptical that were in the final innings' of the trade war between the U.S. and China."
"Cramer Remix: Why you shouldn't fear the Fed",13-07-2018, "Jim Cramer makes the case to value the market just as it is."
"Cramer's lightning round: Cigna's stock is undervalued considering its latest acquisition",13-07-2018, "Jim Cramer delivers his take on callers favorite stocks at lightning speed, including a health care play he thinks is incorrectly priced."
"Cramer suggests investing in regional gambling plays as trade weighs on China-tied giants like Wynn",13-07-2018, "Jim Cramer suggests alternate investments to the beleaguered casino gaming stocks that have properties in Chinese territory Macau."
"The S&P 500 should pass 2,800 after Friday's earnings: Investor",12-07-2018, "Several large banks report earnings before the bell Friday. Investor Steve Grasso anticipates positive earnings and the S&P 500 passing the 2,800 mark. "
"Cramer: Most market-watchers are wrong. Stocks just aren't that expensive",13-07-2018, "Jim Cramer pushes back on some market commentators that see stocks as too pricey."
"Cramer argues that this rally is 'all about China blinking' in the trade war",13-07-2018, "Jim Cramer says China seems to have blinked in its trade dispute with the United States."
"‘Scarred' generation of investors looking at yield curve all wrong, veteran bull Rich Bernstein says",12-07-2018, "Institutional Investor Hall of Famer Richard Bernstein blames a 2008 financial crisis hangover for too much bearishness in the market."
"Earnings will turn the market positive even after tariffs: Market analyst",12-07-2018, "Despite the recent round of tariffs, Tony Dwyer, chief market strategist at Canaccord Genuity, says the upcoming earnings cycle will move the market higher. "
"Cramer Remix: After Trump’s NATO comments, these sectors are worth owning",11-07-2018, "Jim Cramer reveals why U.S. defense and natural gas stocks are strong picks after the NATO Summit."
"Cramer's lightning round: Amazon doesn't always destroy—just look at Roku",11-07-2018, "Jim Cramer shares his take on callers favorite stocks at lightning speed, including a streaming device maker that he thought would be threatened by Amazon."
"Bluestone Lane CEO and key investor explain how Australian coffee chain is taking on Starbucks",11-07-2018, "Jim Cramer sits down with the CEOs of Bluestone Lane and its investor RSE Ventures to find out whats next for the Australian-born coffeehouse."
"'Tweed and tonic' marijuana drinks could be coming to Canada in 2019, says Canopy Growth CEO",12-07-2018, "Jim Cramer sits down with Canopy Growth CEO Bruce Linton, who outlines his cannabis companys game plan for when recreational marijuana becomes fully legal in Canada."
"Cramer flags Mastercard and Visa's 'unbeatable' hedges against China trade fears",11-07-2018, "Jim Cramer explains why the stocks of Mastercard and Visa have strong safeguards against the brewing U.S.-China trade conflict."
"Not even strong earnings can prevent a 10 percent plunge, top Invesco market watcher warns",11-07-2018, "Invescos Kristina Hooper believes Wall Street should brace for trouble."
"Cramer Remix: Jack Henry's stock has great long-term prospects—but there’s a catch",11-07-2018, "Jim Cramer reveals why patience-05-be the best strategy before getting into Jack Henry & Associates."
"Cramer opines on Trump's Supreme Court pick: He'd be a 'subtle, but long-lasting win' for businesses",11-07-2018, "Jim Cramer unpacks what Supreme Court nominee Brett Kavanaugh will mean for the stock market."
"Cramer's lightning round: It's time to buy into lithium play Albemarle",10-07-2018, "Jim Cramer zooms through his take on callers favorite stocks, including a lithium play gearing up for earnings."
